,timecode,transcript,polarity,neg,neu,pos,compound
344,00:39:56.49 - 00:40:21.35,"I don't think that a lot of the times the comparability of different um inventories isn't as like exact because some companies will put the natural gas office, the natural gas usage that they're using in their leased offices, some will put it in scope one because it's a fuel combustion, some will put it in scope to because they consider it purchased energy for example and there's, I've seen it done both ways.","{'neg': 0.028, 'neu': 0.879, 'pos': 0.093, 'compound': 0.6111}",0.028,0.879,0.093,0.6111
345,00:40:21.35 - 00:40:24.02,There's not really clear guidance from the G protocol on it.,"{'neg': 0.211, 'neu': 0.789, 'pos': 0.0, 'compound': -0.3401}",0.211,0.789,0.0,-0.3401
346,00:40:24.02 - 00:40:27.38,If you read it one way you can you can make an argument for both sides.,"{'neg': 0.143, 'neu': 0.857, 'pos': 0.0, 'compound': -0.3612}",0.143,0.857,0.0,-0.3612
347,00:40:27.39 - 00:40:32.11,So I think the comparability sometimes uh struggles.,"{'neg': 0.294, 'neu': 0.706, 'pos': 0.0, 'compound': -0.3612}",0.294,0.706,0.0,-0.3612
348,00:40:32.12 - 00:40:48.84,I know there's efforts like um there's something called the carbon call which I think is an is an effort with like Microsoft and a few other big organizations that are trying to really standardize these carbon accounting principles and make with the goal of making emissions inventories comparable to one another.,"{'neg': 0.0, 'neu': 0.904, 'pos': 0.096, 'compound': 0.6124}",0.0,0.904,0.096,0.6124
349,00:40:48.84 - 00:41:00.33,"So I think that's something that um, would be useful and whether that takes the form of um, I don't know, maybe there's just industry alignment over time or if it's education, I'm not sure.","{'neg': 0.055, 'neu': 0.864, 'pos': 0.081, 'compound': 0.2354}",0.055,0.864,0.081,0.2354
350,00:41:00.34 - 00:41:04.58,"But yeah, like accessible data visualization.","{'neg': 0.0, 'neu': 0.398, 'pos': 0.602, 'compound': 0.7227}",0.0,0.398,0.602,0.7227
351,00:41:04.59 - 00:41:07.81,"Yeah, we're like, yeah, just okay, this is how everyone else is doing it.","{'neg': 0.0, 'neu': 0.532, 'pos': 0.468, 'compound': 0.7783}",0.0,0.532,0.468,0.7783
352,00:41:07.82 - 00:41:18.53,"And, and to some degree, cdP is good for that because you can look at companies cdP responses, but I don't think they're like, I wish that all the methodologies were were open, right?","{'neg': 0.072, 'neu': 0.78, 'pos': 0.148, 'compound': 0.4282}",0.072,0.78,0.148,0.4282
353,00:41:18.53 - 00:41:23.84,"And I know that's something that, that you guys are working on two is like having a, having an open methodology, right?","{'neg': 0.0, 'neu': 0.889, 'pos': 0.111, 'compound': 0.3612}",0.0,0.889,0.111,0.3612
354,00:41:23.97 - 00:41:27.65,"So that people can look at it and say, okay, this is how they're doing it.","{'neg': 0.0, 'neu': 0.888, 'pos': 0.112, 'compound': 0.2263}",0.0,0.888,0.112,0.2263
355,00:41:27.66 - 00:41:29.20,We can do it the same way.,"{'neg': 0.0, 'neu': 1.0, 'pos': 0.0, 'compound': 0.0}",0.0,1.0,0.0,0.0
356,00:41:29.21 - 00:41:37.80,"Um, we have confidence that everyone that uses this methodology is doing it the same way and we can compare our results and it can be comparable year over year, right?","{'neg': 0.0, 'neu': 0.901, 'pos': 0.099, 'compound': 0.5106}",0.0,0.901,0.099,0.5106
357,00:41:37.80 - 00:41:39.36,So that doesn't change over time.,"{'neg': 0.0, 'neu': 1.0, 'pos': 0.0, 'compound': 0.0}",0.0,1.0,0.0,0.0
358,00:41:40.54 - 00:41:53.91,"Oh, another another challenge might be that we deal with less frequently is baseline recalculations for, so for when a company maybe they acquire another company and they're like, okay, how does this affect our target?","{'neg': 0.0, 'neu': 0.849, 'pos': 0.151, 'compound': 0.5719}",0.0,0.849,0.151,0.5719
359,00:41:53.92 - 00:42:05.17,"And that's usually a fairly like painstaking process of explaining to them, okay, how they can recalculate their baseline so that the target is not completely out of whack because they acquired someone or if they sold someone.","{'neg': 0.0, 'neu': 0.888, 'pos': 0.112, 'compound': 0.5267}",0.0,0.888,0.112,0.5267
360,00:42:05.29 - 00:42:12.73,"So I don't know if if you guys have any capabilities for baseline recalculations or, or like the same as consolidation method.","{'neg': 0.0, 'neu': 0.889, 'pos': 0.111, 'compound': 0.3612}",0.0,0.889,0.111,0.3612
361,00:42:13.42 - 00:42:15.61,"So Yeah, kind of.","{'neg': 0.0, 'neu': 0.546, 'pos': 0.454, 'compound': 0.3597}",0.0,0.546,0.454,0.3597
362,00:42:15.62 - 00:42:36.24,"So it's like if if a hypothetical company sets their baseline in 2019 for example, and then this past year they acquire like a company of similar size, their emissions all of a sudden you're gonna almost double and that looks like they've, if you just use the same baseline year, it looked like their emissions went like shot up.","{'neg': 0.0, 'neu': 0.789, 'pos': 0.211, 'compound': 0.9168}",0.0,0.789,0.211,0.9168
363,00:42:36.24 - 00:42:40.29,"Even though that's really not like organic emissions growth, those emissions were already occurring.","{'neg': 0.141, 'neu': 0.706, 'pos': 0.153, 'compound': 0.0546}",0.141,0.706,0.153,0.0546
364,00:42:40.30 - 00:42:42.68,They were just not occurring within the boundary.,"{'neg': 0.0, 'neu': 1.0, 'pos': 0.0, 'compound': 0.0}",0.0,1.0,0.0,0.0
365,00:42:43.10 - 00:42:55.81,"So we'll go through a process sometimes of recalculating that baseline saying that, Okay, if you had acquired that, if you did contain those emissions in your boundary in 2019, this is what your baseline would have been.","{'neg': 0.0, 'neu': 0.95, 'pos': 0.05, 'compound': 0.2263}",0.0,0.95,0.05,0.2263
366,00:42:55.81 - 00:43:05.38,"So in reality you're emissions are like, maybe they're flat, but they didn't like they didn't like double over those last two years when in reality those emissions were already occurring just outside the boundary.","{'neg': 0.0, 'neu': 0.795, 'pos': 0.205, 'compound': 0.8047}",0.0,0.795,0.205,0.8047
367,00:43:05.69 - 00:43:33.19,"Yeah, I know we're working on that um something similar and I know that it's a heavier math lift than so yeah, that that I would say, yeah, that I'd be interested to see um once you guys have something ready to take a look at for, for that perspective, that's I think it's not super intuitive for clients to understand and the math, because you're at some point you're like back casting for this acquired company, it's a little more complicated.","{'neg': 0.036, 'neu': 0.784, 'pos': 0.18, 'compound': 0.8882}",0.036,0.784,0.18,0.8882
368,00:43:33.20 - 00:43:35.89,Um So that would be a tool that I would definitely want to take a look at.,"{'neg': 0.0, 'neu': 0.75, 'pos': 0.25, 'compound': 0.4588}",0.0,0.75,0.25,0.4588
369,00:43:35.90 - 00:43:37,"Yeah, awesome.","{'neg': 0.0, 'neu': 0.0, 'pos': 1.0, 'compound': 0.743}",0.0,0.0,1.0,0.743
370,00:43:37 - 00:43:38.28,"Yeah, I'll keep you in mind.","{'neg': 0.0, 'neu': 0.694, 'pos': 0.306, 'compound': 0.296}",0.0,0.694,0.306,0.296
371,00:43:38.29 - 00:43:47,"We definitely want to start now that there are some customers, you know that we have a good amount, we want to start be able to co create with them.","{'neg': 0.0, 'neu': 0.7, 'pos': 0.3, 'compound': 0.8074}",0.0,0.7,0.3,0.8074
372,00:43:47.01 - 00:43:51.97,"So um yeah, I'll make sure to share some of that work once it's ready.","{'neg': 0.0, 'neu': 0.537, 'pos': 0.463, 'compound': 0.8166}",0.0,0.537,0.463,0.8166
373,00:43:52.17 - 00:43:53.48,Yeah.,"{'neg': 0.0, 'neu': 0.0, 'pos': 1.0, 'compound': 0.296}",0.0,0.0,1.0,0.296
374,00:43:53.49 - 00:43:55.52,"Um Well, thank you very much.","{'neg': 0.0, 'neu': 0.465, 'pos': 0.535, 'compound': 0.5574}",0.0,0.465,0.535,0.5574
375,00:43:55.53 - 00:44:01.44,"This has been super, super helpful and yeah, we'll be in touch.","{'neg': 0.0, 'neu': 0.385, 'pos': 0.615, 'compound': 0.9153}",0.0,0.385,0.615,0.9153
376,00:44:01.45 - 00:44:01.74,Great.,"{'neg': 0.0, 'neu': 0.0, 'pos': 1.0, 'compound': 0.6249}",0.0,0.0,1.0,0.6249
